,0
240,"<p>Experts expect the Nifty 50 to gradually march toward its record high of 26,277 in the upcoming sessions once it starts trading above 26,000. Until then, consolidation and rangebound trading may continue, with immediate support at 25,850–25,800.</p>"
241,"<p>Nearly 160 stocks touched their 52-week high on the BSE, including City Union Bank, Tata Steel, JSW Steel, Indian Bank, SBI Life Insurance, Laurus Labs, HBL Engineering, Hindalco Industries, PNB, Federal Bank, Bank of Baroda, Bank of India, SBI, Bharti Airtel, Canara Bank, Paytm, Grasim Industries, Cummins India, among others.</p>"
242,"<p>Benchmark index Nifty 50 recovered most of its losses to settle at 25,936, lower by 30 points or 0.1 percent, on its monthly expiry session.</p>"
243,"<p>Stock market today: Senex, Nifty cut losses ahead of Fed policy outcome on October 29.</p>"
244,"<p>Navneet Munot said channeling idle gold, silver into equity instruments with lock-in and tax efficiency will unlock</p>"
245,"<p>Stock market today: Sensex, Nifty traded lower on October 28 as rising VIX, FII selling weighed on market sentiment</p>"
246,"<p>Benchmark indices Nifty 50 and Sensex opened on a positive note, as traders were optimistic on the upcoming summit with U.S. President Donald Trump and Chinese President Xi Jinping.</p>"
247,"<p>Meaningful appreciation in the rupee against US dollar is unlikely in the near term given structural headwinds from trade imbalances and dollar strength, though tactical stabilization around current levels is expected.</p>"
248,"<p>The better-than-expected earnings show from the quarter ended September, coupled with strong DII inflows have maintained the market's strength.</p>"
249,"<p>The Foreign Institutional Investors (FIIs) sold equities of Rs 55 crore on October 27, while Domestic Institutional Investors (DIIs) purchased equities of Rs 2492 crore on the same day.</p>"
250,"<p>Bajaj Finserv, Power Grid, ONGC, Coal India and Trent were among major losers on the Nifty, while gainers were Tata Steel, SBI Life Insurance, JSW Steel, HDFC Life and L&amp;T. BSE Midcap and smallcap indices ended flat. On the sectoral front, metal and PSU Bank indices rose 1.2 percent each, while IT, pharma, FMCG and realty shed 0.5-1%.</p>"
251,"<p>Given the healthy technical and momentum indicators, if the Nifty 50 reclaims and sustains above 26,000, the rally toward 26,100 (previous week’s high) followed by 26,277 (record high) is possible, with immediate support at 25,900, followed by 25,800–25,700 being the key support zone.</p>"
252,"<p>Experts said that if the Nifty 50 index manages to stay above this level, then 26,100 is the level to watch, followed by the record high of 26,277, while immediate support is placed at 25,900, followed by 25,800 (around Monday’s low).</p>"
253,"<p>Trading near all-time high levels, the banking index continues to exhibit strong bullish undertones, with all major moving averages and momentum indicators aligned in favour of the bulls.</p>"
254,"<p>After opening higher, Sensex and Nifty extended gains on hopes of further rate cut by the US Fed and a growing confidence over a potential US-China trade in the offing.</p>"
255,"<p>Benchmark indices Nifty 50 and Sensex settled higher by 0.7 percent each on October 27, as positive global cues lifted investor sentiment.</p>"
256,"<p>Stock market today: Sensex, Nifty gave up some gains as investors booked profits.</p>"
257,"<p>Stock market today: Sensex, Nifty rose amid a sharp rally in global markets, as softer-than-expected US inflation report raised hopes of Fed rate cuts.</p>"
258,"<p>Dalal Street's frontline indices Nifty 50 and Sensex saw a positive open in trade on October 27, as positive global cues lifted investor sentiment.</p>"
259,<p>GIFT Nifty hints at bullish start for Sensex and Nifty 50 on Monday amind easing U.S.–China trade tensions and Fed rate cut hopes.</p>
260,"<p>Any constructive statements or forward-looking updates emerging from the Asian Summit could strengthen investor confidence and sustain the current market optimism, supporting equities in the near term.</p>"
261,"<p>Nifty ended the week positive but below opening levels. Market focus shifts to corporate earnings and potential US-India trade deal, while progress in US-China talks sustains global positive sentiment</p>"
262,<p>Milan Vaishnav said he would continue looking at HDFC Bank and Bharti Airtel.</p>
263,<p>Gold fell — after posting its first weekly drop since mid-August — as progress on a US-China trade deal sapped haven demand.</p>
264,"<p>The market is expected to be rangebound and consolidative with focus on further corporate earnings, central banks meetings, monthly auto sales numbers, further developments with respect to India-US trade deal talks and US shutdown, and the scheduled meeting between US and Chinese Presidents in South Korea on October 30.</p>"
265,"<p>BSE Midcap index added 0.7% and smallcap index rose 0.5%. SBI Life Insurance, Bharti Airtel, Reliance Industries, SBI, Eternal were among top gainers on the Nifty, while losers were Bharat Electronics, Kotak Mahindra Bank, Infosys, Adani Ports, Bajaj Finance. Except media, pharma, all other sectoral indices ended in the green with metal, PSU Bank, oil &amp; gas, realty index up 1-2%.</p>"
266,"<p>If the Nifty 50 decisively breaks 25,700 and sustains below it, it can drive the index toward 25,500 in the short term. However, on the higher side, 25,950–26,000 is expected to be a key resistance zone, experts said.</p>"
267,"<p>The Nifty 50 may have entered a consolidation phase in the short term, possibly before resuming its uptrend. A decisive fall below 25,700, the immediate support, can open the door to 25,500, a crucial support level, which could strengthen bearish momentum, experts said.</p>"
268,"<p>Rohit Beri expects the trend in de-dollarization to continue and central bank demand for gold to stay strong. However, the current rally in gold prices may not last for long. So, one has to be very careful.</p>"
269,"<p>Shooting Star candlestick pattern reflects that bulls attempted to drive prices higher but faced selling pressure near the top, said Sudeep Shah.</p>"
270,"<p>In this month, FII sold equities of Rs 244.02 crore, while DII bought equities worth Rs 33,989.76 crore, till now.</p>"
271,"<p>The year ahead is expected to deliver healthier stock returns — likely in line with the long-term average range of 12–15 percent, said Rakesh Vyas of Quest Investment Advisors.</p>"
272,"<p>The weekly options data suggests that the Nifty may trade in the 25,500–26,000 range in the short term, with a broader range between 25,000–26,500.</p>"
273,"<p>Positive global cues weighed on the market sentiment, which led to partial recovery on October 24</p>"
274,"<p>Cipla, HUL, Adani Ports, Max Healthcare, UltraTech Cement were among top losers on the Nifty, while gainers were Hindalco, Bharti Airtel, ONGC, Shriram Finance, ICICI Bank.</p>"
275,"<p>Benchmark indices ended lower as profit-taking in banking and consumer stocks halted a six-session winning streak, with traders turning cautious amid uncertainties.</p>"
276,"<p>Stock market today: Sensex, Nifty snapped a six-day rally to trade lower amid renewed FII selling and profit booking.</p>"
277,"<p>Indian equities opened flat on Friday, despite positive global cues, as investor sentiment turned cautious on October 24.</p>"
278,"<p>Indian equity benchmarks may open flat on October 24, with GIFT Nifty futures trading near the flatline, though positive global cues could lend some early support.</p>"
279,"<p>The GIFT Nifty is trading higher at around 26,034.50, indicating a higher opening for the day</p>"
280,"<p>Cipla, HUL, Kotak Mahindra Bank, Max Healthcare, UltraTech Cement were among top losers on the Nifty, while gainers were Hindalco, Bharti Airtel, Shriram Finance, ICICI Bank. On the sectoral front, metal index up 1%, while FMCG, PSU Bank, pharma, private bank, IT, consumer durable down 0.5-1%. BSE Midcap and Smallcap indices are trading flat.</p>"
281,"<p>These three themes position India for global outperformance in the year ahead, both in relative growth and market returns, Trideep Bhattacharya believes.</p>"
282,"<p>The Nifty 50 index is expected to remain rangebound in the upcoming sessions, with immediate support at 25,700, while closing and sustaining above 25,900 can take the index toward the 26,000–26,100 zone, experts said.</p>"
283,"<p>Experts note that as long as the Nifty 50 index defends the 25,700 zone support, the upmove toward the 26,000–26,100 hurdle cannot be ruled out, followed by the record high of 26,277 — the crucial resistance level beyond which the index would enter uncharted territory.</p>"
284,"<p>Monthly options data suggested that the Nifty 50 is expected to remain within the 25,500–26,500 range in the short term.</p>"
285,"<p>On Thursday, equity benchmarks extended their rally for the sixth straight session amid optimism over a potential India-US trade deal.</p>"
286,"<p>More than 200 stocks touched their 52-week high on the BSE, including Bank of India, IDFC First Bank, City Union Bank, Shriram Finance, Axis Bank, Indian Bank, AU Small Finance Bank, Titan Company, Bajaj Finance, Hindalco Industries, L&amp;T, SBI, HDFC Bank, Maruti Suzuki, PNB, Bajaj Finserv, Ceat, Federal Bank, Grasim Industries, among others.</p>"
287,"<p>After staging an impressive open, the benchmark indices Nifty 50 and Sensex erased their wins to settle at the flatline on October 23.</p>"
288,"<p>After hitting fresh record highs earlier in the session, investors turned to profit booking, leading to a pullback in key indices.</p>"
289,"<p>Stock market today: Sensex, Nifty rose on hopes of a possible trade deal annoucement between India and the US.</p>"
290,"<p>Dalal Street's mood remains positive and optimistic as the U.S. reportedly plans to slash tariffs on Indian imports, supporting the markets.</p>"
291,"<p>Despite weak global cues, the benchmark indices Nifty 50 and Sensex may be poised for a strong start in trade on October 23.</p>"
292,"<p>The yields on US 10-year Treasury were up marginally at 3.95 percent, while US 10-year Treasury yield remained unchanged at 3.44.</p>"
293,"<p>Demand recovery for Indian IT Services seems more likely than not in the next 12 months, said Saurabh Mukherjea of Marcellus Investment Managers.</p>"
294,"<p>Foram Chheda noted the Nifty 50 has broken out of a symmetrical triangle pattern, which confirms the potential for an upward move.</p>"
295,"<p>BSE Midcap index down marginally, while smallcap index shed 0.4%. Infosys, HCL Technologies, TCS, Shriram Finance, Axis Bank were among top gainers on the Nifty, while losers were Eternal, Interglobe Aviation, Bharti Airtel, Tata Consumer, Eicher Motors. On the sectoral front, IT index rose 2%, Private Bank index up 0.5%, while oil &amp; gas index down 0.6%.</p>"
296,"<p>According to experts, the Nifty 50 index may consolidate for a couple of sessions with immediate 25,700–25,500 support before gaining strength for an upward journey toward 26,000–26,300.</p>"
297,"<p>The Nifty 50 is expected to face a hurdle at 26,000, as decisively surpassing this level could open the door for a move to 26,200-26,300 in the upcoming sessions, provided the index defends support in the 25,750-25,700 zone, according to experts.</p>"
298,"<p>Definedge’s Prashant Shah sees Nifty heading beyond 30,000 in Samvat 2082, with metals, defence, and midcaps poised to surprise investors.</p>"
299,"<p>The Nifty remains firmly positioned in a buy-on-dips setup heading into the monthly expiry, with sentiment tilted positively.</p>"
300,"<p>Vikas Khemani sees Nifty hitting 30,000 by next Samvat, driven by Fed rate cuts, FII inflows, and an IT sector comeback after years of de-rating.</p>"
301,"<p>Biggest Nifty gainers were Cipla, Bajaj Finserv, Axis Bank, Infosys, Grasim, while losers included Kotak Mahindra Bank, ICICI Bank, HCL Technologies, Max Healthcare, Asian Paints. Among sectors, metal, media, telecom up 0.3% each. The BSE midcap index rose 0.2 percent and smallcap index added nearly 1 percent.</p>"
302,"<p>Top sector picks for the new year are consumer discretionary including auto and auto ancillary, financial sector, and IT, said Ashish Kyal.</p>"
303,"<p>USD weakness, policy chaos in the US, and overvaluation in US markets could potentially redirect foreign flows to emerging markets like India, said Nilesh Shah.</p>"
304,"<p>Chasing growth in midcaps will continue to remain a strategy that will reward long term investors in the year to come, said Rohit Srivastava.</p>"
305,"<p>The Nifty 50 index is expected to face resistance at the 25,900–26,000 zone on the Muhurat Trading day, while support is placed at 25,700, followed by 25,500 as a crucial level, experts said.</p>"
306,"<p>As long as the Nifty 50 sustains above 25,700, a rally towards the 25,950–26,000 zone can't be ruled out before potential consolidation sets in. The crucial support remains at 25,500, experts said.</p>"
307,"<p>Weekly derivative data indicated that the Nifty 50 is likely to face resistance in the 25,850–25,900 zone, with support in the 25,800–25,750 range.</p>"
308,<p>Investors opted to book some profit after a strong rally driven by upbeat September quarter results.</p>
309,"<p>Stock market today: Sensex, Nifty rose amid strong buying in heavyweight stocks. Buying in foreign fund inflows and easing crude oil prices lifted overall market sentiment.</p>"
310,"<p>Rahul Singh of Tata Asset Management says valuations today are still not cheap, but they’ve certainly normalised compared to the previous year. From here on, he expects the focus to shift more towards earnings growth.</p>"
311,"<p>HDFC Bank has rebounded off the support area and is moving towards its high and may see a breakout above Rs 1,025 level that could lead the stock to fresh lifetime highs, said Milan Vaishnav.</p>"
312,"<p>Oil prices dipped on Monday, pressured by worries over a global glut as escalating US.-China trade tensions added to concerns about an economic slowdown and weaker energy demand.</p>"
313,"<p>The Nifty50 gained 1.68% driven by FII buying, while small-caps dropped 0.6% and mid-caps remained flat. FIIs were net buyers, but overall net sales were Rs 586.76 crore</p>"
314,<p>Dalal Street's headline indices are likely to extend their winning streak to the fourth consecutive session in trade on October 20.</p>
315,"<p>Reliance Industries, Shriram Finance, Bajaj Finserv, Cipla, Dr Reddy's Labs were among major gainers on the Nifty, while losers were ICICI Bank, Eternal, Adani Ports, JSW Steel, M&amp;M. BSE Midcap index added 0.7%, and smallcap index rose 0.6%. On the sectoral front, PSU bank index up 3%, oil &amp; gas, telecom up 1% each, while pharma, realty, metal, IT up 0.5% each.</p>"
316,"<p>Given the powerful rally with encouraging technical and momentum indicators, if the Nifty 50 decisively closes the bearish gap by surpassing 25,740, the upward journey toward 25,900–26,000 can’t be ruled out. However, 25,500 can act as immediate support, experts said.</p>"
317,"<p>In the coming truncated week starting from October 20, the market sentiments are expected to remain positive despite intermittent volatility, with focus on more corporate earnings, further update related to India-US trade deal talks, US inflation, China's GDP numbers, and flash PMI data, experts said.</p>"
318,"<p>Experts believe that the Nifty 50 appears poised for a strong bull run. If it closes and sustains above the long bearish gap of October 3, 2024 (25,740), the first target to watch will be 26,000, followed by 26,200–26,300. This zone coincides with the record high of 26,277, last seen on September 27, 2023. On the downside, immediate support is placed at 25,500.</p>"
319,"<p>Vipul Bhowar believes there are good investment opportunities in metals, quick-service restaurants (QSR), and building materials.</p>"
320,"<p>While it may be premature to project extremely optimistic levels like 29,000–30,000, given the strong technical structure and improving macros, Nifty could well move towards the 27,000 zone in Samvat 2082, said Sudeep Shah of SBI Securities.</p>"
321,"<p>The week ahead will be a holiday-led truncated week due to Diwali. Investors are likely to remain cautious in view of the release of key economic data, such as US inflation, employment, and India’s PMI figures, says Vinod Nair, Head of Research, Geojit Investments.</p>"
322,"<p>Even after 59 percent rally in the Samvat 2081, Nimesh Chandan of Bajaj Finserv AMC expects gold to remain strong in the coming year, supported by persistent ETF inflows and robust central bank buying.</p>"
323,"<p>Nilesh Jain of Centrum Broking expectss the banking index to potentially surpass the 60,000 mark in the upcoming Samvat year.</p>"
324,"<p>Weekly derivative data suggested that the Nifty 50 is expected to remain in the 25,500–26,000 range in the upcoming sessions.</p>"
325,"<p>Nifty Bank touched fresh record high of 57,830.20, intraday, rising nearly 10,000 points from its March 11, 2025 low of 47,853.95.</p>"
326,"<p>Dalal Street's benchmark indices Nifty 50 and Sensex closed the week with gains of roughly two percent each, while extending their winning streak to the third session.</p>"
327,"<p>Stock Market Today: Sensex, Nifty turned volatile in the second half as weak global sentiment weighed on investor mood.</p>"
328,"<p>Stock Market Today: Sensex, Nifty gained as FIIs continued their buying for the second straight session on Thursday. Hopes of US Fed rate cuts also aided the positive sentiment.</p>"
329,"<p>The GIFT Nifty indicates a muted start for Dalal Street on October 17, as weak cues from Wall Street and Asian markets are likely to dampen sentiment.</p>"
330,"<p>Oil prices edged lower in early trade on Friday, heading for a weekly loss, with uncertainty over global energy supplies after U.S. President Donald Trump and Russian President Vladimir Putin agreed to meet in Hungary to discuss ending the war in Ukraine.</p>"
331,"<p>The IPO pipeline is expected to remain healthy in Samvat 2082, supported by steady domestic liquidity, and sustained investor participation, Jaspreet Singh Arora said.</p>"
332,"<p>Asian Paints, Bharti Airtel, Max Healthcare, ITC, M&amp;M were among major gainers on the Nifty, while losers were Wipro, Infosys, Eternal, HCL Technologies, Tech Mahindra. BSE midcap and smallcap indices shed 0.4% each. Among sectors, media, IT, metal, PSU Bank indices fell 0.5-1%, while auto, bank, healthcare, FMCG, consumer durables rose 0.5-1%.</p>"
333,"<p>According to experts, the Nifty 50 index is gradually expected to achieve its high (25,669) of the current year, followed by the 26,000 zone. However, support is placed at the 25,400–25,300 zone. Meanwhile, the Bank Nifty is very close to its record high (57,628).</p>"
334,"<p>Experts expect the Nifty 50 to reach this year's high of 25,669 soon, followed by 26,000, a crucial resistance level before the record high hurdle. However, the 25,400–25,300 range can act as a support zone.</p>"
335,"<p>Weekly options data suggested resistance for the Nifty 50 at 25,700–25,800, with support in the 25,500–25,300 zone.</p>"
336,"<p>Biggest Nifty gainers were Nestle India, Tata Consumer, Titan Company, Kotak Mahindra Bank, Axis Bank, while losers included HDFC Life, Shriram Finance, Sun Pharma, Jio Financial and Eternal.</p>"
337,"<p>The bulls remained in control for the second straight session as Nifty crossed the psychological hurdle of 25,500, while Sensex soared 900 points.</p>"
338,"<p>Stock Market Today: Sensex, Nifty witnessed a strong rally, driven by robust buying in financial and other key sectors, resulting in a total market capitalization increase of Rs 3 lakh crore.</p>"
339,"<p>Dalal Street opened higher for the second straight session on October 16, lifted by optimism over potential U.S. Fed rate cuts and hopes of progress in a U.S.-India trade deal.</p>"
340,"<p>Data from NSDL shows that between October 7 and October 14, FIIs turned net buyers in five of the last seven sessions, purchasing over Rs 3,000 crore in the secondary market.</p>"
341,"<p>Investor sentiment strengthened after Fed Chair Jerome Powell noted that while the U.S. labour market remained weak, the economy was on a firmer footing.</p>"
342,<p>Gold rose to a record as heightened US-China frictions and bets the Federal Reserve will press on with monetary easing through the end of the year supported demand.</p>
343,"<p>Valuations have turned more supportive, with the markets now trading close to the historical averages. Any resolution on the trade deal front can remove one big overhang and result in improved sentiment for the markets, said Milind Muchhala.</p>"
344,"<p>Biggest Nifty gainers were Nestle India, Tata Consumer, Titan Company, Kotak Mahindra Bank, Axis Bank, while losers included HDFC Life, Shriram Finance, Sun Pharma, Jio Financial and Eternal. Except PSU Bank (down 0.4%), all other sectoral indices ended in the green with auto, bank, consumer durable, realty FMCG, oil &amp; gas up 0.5-1.7 percent. The BSE midcap index rose 0.3 percent and smallcap index added 0.4 percent.</p>"
345,"<p>According to experts, the Nifty 50 is expected to see a falling resistance trendline breakout (around 25,380), followed by 25,450 as the key resistance — which can open the door for the June high. However, support is placed at 25,150 and 25,060.</p>"
346,"<p>The continuation of the higher high-higher low formation and healthy momentum indicators suggest that the Nifty 50 is gradually set to inch toward 24,400-24,500, the September swing high. Beyond that, 25,670 is the crucial hurdle to watch, which could open the door for a record high.</p>"
347,"<p>Sensex climbed 575.45 points, or 0.7 percent, to settle at 82,605.43. During the day, it jumped 697.04 points, or 0.84 percent, to 82,727.02.</p>"
348,"<p>Biggest Nifty gainers were Bajaj Finserv, Bajaj Finance, Trent, Nestle India, Asian Paints, while losers were Infosys, Tata Motors, Bajaj Auto, Tech Mahindra, Axis Bank.</p>"
349,"<p>Dalal Street’s benchmarks, Nifty 50 and Sensex, rallied on October 15 as dovish comments from the U.S. Federal Reserve Chair boosted investor sentiment.</p>"
350,"<p>Stock market today: Sensex, Nifty rose on hopes of softer US interest rates after recent comments of Fed chief Jerome Powell.</p>"
351,"<p>Indian equities opened slightly higher on Wednesday, supported by positive cues from India-US trade talks and broad-based sectoral gains led by Realty and PSU Bank stocks.</p>"
352,"<p>Analysts noted that the markets may remain range-bound, with global trends, FII flows, and Q2FY26 earnings likely to guide near-term direction.</p>"
353,"<p>The Foreign Institutional Investors (FIIs) extended their selling on second day on October 14 as they sold equities over Rs 1500 crore, while Domestic Institutional Investors (DIIs) purchased equities of Rs 3661 crore on the same day.</p>"
354,"<p>Biggest Nifty gainers were Bajaj Finserv, Bajaj Finance, Trent, Nestle India, Asian Paints, while losers were Infosys, Tata Motors, Bajaj Auto, Tech Mahindra, Axis Bank. All the sectoral indices ended in the green with realty index up 3%, while power, consumer durables, PSU Bank, metal and telecom indices up 1-2%. BSE midcap index added 1%, and smallcap index jumped 0.7%.</p>"
355,"<p>Sonam Srivastava of Wright Research PMS believes India’s digital and internet ecosystem is in a structural upcycle, supported by profitability improvements, expanding user bases, and formalization-driven growth.</p>"
356,"<p>If the Nifty 50 index stays above 25,060 (previous day’s low), it may attempt an upmove toward the 25,200–25,300 zone. Above this, 25,400–25,500 are the levels to watch. However, a move below 25,060 can drag the index down toward 24,950 (50-day EMA), experts said.</p>"
357,"<p>If the Nifty 50 breaks below the 25,060 and 24,950 support levels, the bears may take full control. Until then, consolidation and range-bound trading may persist, according to experts.</p>"
358,"<p>The weekly options data suggested that the Nifty is still expected to trade within the 25,000-25,500 range, with the broader range being 24,500-25,500.</p>"
359,"<p>More than 150 stocks touched their 52-week high on the BSE, including Anand Rathi, MCX India, HBL Engineering, RBL Bank, L&amp;T Finance, Muthoot Finance, Eternal, Bajaj Finance, among others.</p>"
360,"<p>Headline gauges Nifty 50 and Sensex fell to selling pressure after recording an open in the green for the session on Tuesday, October 14.</p>"
361,<p>Markets also remained volatile due to the Nifty expiry.</p>
362,"<p>In absolute terms, Hong Kong-based broking house CLSA noted that India remains the most expensive emerging market after Taiwan.</p>"
363,"<p>After seeing a firm start for the October 14 session, the benchmark indices succumbed to selling pressure as investors booked their profits.</p>"
364,"<p>FIIs turned net sellers again on Monday, offloading equities worth Rs 240.10 crore after four consecutive sessions of buying.</p>"
365,"<p>Indian indices started October 14 on a positive note, with IT and metal stocks leading gains. HCL Technologies’ strong Q2 results and silver prices touching record highs lifted sentiment, while investors await the LG Electronics listing.</p>"
366,"<p>Investors will closely watch the debut of the LG Electronics IPO, following yesterday’s flat listing of the Tata Capital IPO</p>"
367,"<p>Oil prices rose on Tuesday as early signs of a thaw in U.S.-China trade tensions bolstered market sentiment, alleviating concerns over global fuel demand.</p>"
368,"<p>The data centre space is buzzing, and it looks like it’ll offer some solid opportunities over the next year, said Puneet Sharma of Whitespace Alpha, AIF.</p>"
