,0
0,"<p>Weekly options data suggested that 26,000 is likely to be the crucial level for further direction in the Nifty 50, with resistance at 26,200 and support at 25,500.</p>"
1,"<p>Sectoral trends reflected the uneven mood in the market. Nifty Media emerged as the worst performer, falling 0.8 percent, followed by Nifty IT and Nifty Consumer Durables, each shedding 0.5 percent.</p>"
2,"<p>On the sectoral front, metal, pharma, PSU Bank and realty added 0.5-1%, while consumer durables, IT, media, oil &amp; gas shed 0.5% each.</p>"
3,"<p>Stock markets today: Easing VIX, value buying were also among key factors weighing on the improving market sentiment</p>"
4,"<p>The Gift Nifty was trading at 25,980, up 0.05 percent from its previous close</p>"
5,"<p>Wall Street stocks closed higher on Monday, extending Friday's rally as increased odds that the US Federal Reserve will lower its Fed funds target rate in December helped investors look past concerns about inflated tech valuations.</p>"
6,"<p>GST rationalisation and increased credit borrowing in the upcoming festive season is going to boost the growth in NBFCs, said Divam Sharma.</p>"
7,"<p>On the sectoral front, metal, pharma, PSU Bank and realty added 0.5-1%, while consumer durables, IT, media shed 0.5% each. BSE Midcap and smallcap indices ended higher. Hindalco Industries, SBI, Bharat Electronics, Shriram Finance, HDFC Life were among major gainers on the Nifty, while losers included Adani Enterprises, TMPV, Infosys, HDFC Bank and Trent.</p>"
8,"<p>The Nifty is expected to trade in the range of 25,850-26,250 (previous week’s range) in the upcoming sessions. A decisive break on either side may give a clear direction, as a move below this range could strengthen the bears.</p>"
9,"<p>The next support for the Nifty 50 is placed at 25,850, the lower end of the previous week's range (25,850–26,250) and the midline of the Bollinger Bands. If the index decisively breaks this level, bears may turn stronger and a fall toward 25,700 is possible. On the higher side, 26,100 and 26,250 are the hurdles to watch, experts said.</p>"
10,"<p>Monthly options data indicated that the Nifty may trade in the 25,700–26,200 range in the short term.</p>"
11,"<p>Broader indices underperformed the main indices, as market fell during a last-hour selloff with breadth favouring the decline.</p>"
12,"<p>Overall, after Q2 earnings, Gautam Duggad has raised earnings estimates of coverage universe by 2.3 percentage points for FY26 led by oil &amp; gas, PSU banks, telecom, insurance, and metals.</p>"
13,"<p>After opening in the green, the benchmark indices Nifty 50 and Sensex erased all their gains to settle with losses on November 24.</p>"
14,"<p>Net inflows plunged 92% in September as wealthy investors booked profits, cut equity exposure, unwound derivative bets and diverted money overseas, even as AUM hit a new peak on market gains and EPFO support.</p>"
15,"<p>A booming IPO market, strong listing gains and SEBI’s curbs on mutual funds’ pre-IPO placements are driving PMS and AIF managers deeper into private-market deals, turning unlisted equity into the industry’s fastest-rising allocation.</p>"
16,"<p>Nifty and Sensex opened mildly higher on November 24, supported by positive global cues and improving expectations for FY27 earnings growth.</p>"
17,"<p>Indian markets are set for a positive start on November 24, with GIFT Nifty indicating early gains despite mixed global cues and investors tracking key U.S. data releases this week.</p>"
18,<p>Asian shares were trading higher with Taiwan Weighted and Kospi up 1% each. Japan markets is closed for a holiday</p>
19,"<p>Tech Mahindra, Eicher Motors, Bajaj Auto, Wipro, Infosys are among major gainers on the Nifty, while losers are JSW Steel, Bharat Electronics, Max Healthcare, Grasim Industries, Dr Reddys Labs. Among sectors, except IT, all other indices ended in the red with media, metal, realty, pharma, oil &amp; gas, FMCG down 0.4-1%. BSE midcap index fell 0.3%, while smallcap index down 0.8%.</p>"
20,"<p>The market this week, starting November 24, is expected to remain rangebound with a positive bias, focusing on India-US trade talks, the Ukraine peace deal, Q2FY26 GDP data, and FII activity, experts say.</p>"
21,"<p>Global markets fell after strong US jobs data dimmed rate cut hopes, while the Indian rupee hit a record low and US-India trade uncertainty hurt investor sentiment.</p>"
22,"<p>If the Nifty 50 reclaims and sustains above 26,100, the 26,250 level is expected to act as a crucial hurdle for further upside. On the lower side, 26,000 remains the key level to watch for any potential downward move.</p>"
23,"<p>If the Nifty 50 convincingly breaks below the 26,000 mark, the 25,850–25,800 zone will be crucial to watch on the downside. On the other hand, sustaining above this range can drive the index toward 26,250, followed by 26,500, which remain the key upside targets, experts said.</p>"
24,"<p>The prolonged corporate earnings per share (EPS) downgrade cycle has finally stabilized over the last three months. The Q2 FY26 results have tracked better than expectations, leading to selective earnings upgrades, said Pranab Uniyal.</p>"
25,"<p>Sector-wise, Nifty IT gained 1.6%, Auto rose 1%, and Bank added 0.6%. Meanwhile, Realty slipped 3.7%, Metal fell 3.3%, and Media dropped 2.4%.</p>"
26,"<p>Pradeep Gupta of Anand Rathi Group said that while some pockets still face valuation pressures and near-term volatility persists due to US policy uncertainty, the domestic backdrop remains resilient.</p>"
27,"<p>“The charts may be celebrating near the highs, but the broader market’s behaviour in the coming days will reveal whether this rally gains real strength, or remains a selective rise dressed up as a bull run,” said Sudeep Shah.</p>"
28,"<p>Monthly options data indicated that the Nifty 50 may trade in the 26,000–26,200 range in the near term, with a broader range of 25,700–26,500.</p>"
29,"<p>Despite mid-session buying, the market ended near day's low.</p>"
30,"<p>Nifty and Sensex slipped over a half a percent on November 21 as weak global cues dragged sentiment, though both indices still ended the week in positive territory.</p>"
31,"<p>Stock market today: Sensex, Nifty recovered from early losses as FIIs continued their buying streak for the second straight day.</p>"
32,"<p>Stock market today: Sensex, Nifty decline was led by a combination of weak global trends, fading hopes of a US rate cut and selling pressure in IT, metal shares.</p>"
33,"<p>Benchmark indices may pause near highs amid global weakness and consolidation, while previous resistance levels have now turned into reliable support, reinforcing the long-term bullish bias.</p>"
34,"<p>Aparna Shanker continues to favour financials, lenders, capital market plays and insurers, where formalization, productivity improvements, and better balance-sheet strength are translating into durable growth opportunities.</p>"
35,"<p>The Foreign Institutional Investors (FIIs) extended their buying on second consecutive day on November 20 as they purchased equities of Rs 283 crore, while Domestic Institutional Investors (DIIs) bought equities of Rs 824 crore, on the same day.</p>"
36,"<p>Sensex Today | Stock Market LIVE Updates: BSE Midcap and Smallcap indices down 1 percent each. Except auto, all other sectoral indices are trading in the red with capital goods, realty, PSU Bank, metal down 1 percent each. Maruti Suzuki, M&amp;M, Interglobe Aviation, Max Healthcare, Eicher Motors are among major gainers on the Nifty, while losers are Tata Steel, Hindalco Industries, Bajaj Finance, JSW Steel and HCL Technologies.</p>"
37,"<p>Overall, the trend remains in favour of the bulls, who can drive Nifty 50 gradually toward 26,300 (near the record high) and 26,500. However, until it surpasses the record high, consolidation may be seen with support at the 26,100–26,000 zone.</p>"
38,"<p>Given the strengthening momentum, experts expect the Nifty 50 to touch its record high of 26,277 soon, provided it holds 26,100 as an immediate support. Beyond this, 26,500 is the level to watch, while the sacrosanct support is placed at 25,800.</p>"
39,"<p>Monthly options data suggests that the Nifty 50 may march toward 26,500 in the short term, supported by the 26,000–25,900 zone.</p>"
40,"<p>Eicher Motors, Bajaj Finserv, Bajaj Finance, Reliance Industries, Tech Mahindra were among major gainers on the Nifty, while losers were Asian Paints, HCL Technologies, Titan Company, Apollo Hospitals and Tata Steel.</p>"
41,"<p>Nifty and Sensex extended their uptrend on November 20, rising over half a percent as strong global cues and robust buying interest pushed the indices higher.</p>"
42,"<p>Nifty surged past the 26,200 mark for the first time since September 2024, while Nifty Bank hit a fresh record high, driving market optimism. Heavyweights like Reliance Industries and HDFC Bank were among the top contributors to the index’s gains. Sectorally, defence, financials, and oil &amp; gas indices led the rally. However, broader markets lagged behind, with overall market breadth remaining negative. Catch Nandita Khemka and Yatin Mota as they discuss stocks on radar.</p>"
43,"<p>India’s growth outlook is improving as domestic policy support, potential US tariff relief and a fresh earnings upcycle converge to strengthen overall sentiment.</p>"
44,"<p>Stock market today: Sensex, Nifty rose amid strong global cues and fresh FII inflows.</p>"
45,"<p>With volatility easing and institutional sentiment turning positive, analysts say largecaps may continue to outperform.</p>"
46,"<p>The Foreign Institutional Investors (FIIs) turned net buyers as they bought equities of Rs 1580 crore on November 19, while Domestic Institutional Investors (DIIs) purchased equities of Rs 1360 crore, on the same day.</p>"
47,"<p>A correction is already underway in the US markets. The US has massive issues with its K-shaped recovery and now a potential nasty overhang from tariffs and over-enthusiasm towards, said P Krishnan.</p>"
48,"<p>Broader indices underperformed the main indices with BSE Midcap and smallcap indices ending on flat note. On the sectoral front, auto, capital goods, oil &amp; gas, private bank, energy up 0.3-0.6%, while consumer durable, media, PSU Bank down 0.3-1 percent. Eicher Motors, Bajaj Finserv, Bajaj Finance, Reliance Industries, HDFC Bank were among major gainers on the Nifty, while losers were Asian Paints, HCL Technologies, Titan Company, HUL and Sun Pharma.</p>"
49,"<p>The Nifty 50 is expected to reclaim 26,100 (October high) provided it holds the psychological 26,000 zone. Above 26,100, 26,300 (near record high) can’t be ruled out; however, immediate support is placed at the 25,950–25,850 zone, experts said.</p>"
50,"<p>If the Nifty 50 successfully crosses and consistently holds above 26,100 zone, a move toward 26,300 (near the record high) could be easily seen in the upcoming sessions. However, support is placed in the 25,750–25,850 zone, according to experts.</p>"
51,"<p>Monthly options data suggested that the 26,000 level is expected to be a crucial zone for determining further direction in the Nifty 50.</p>"
52,"<p>Nifty Bank continued hitting fresh record high on the third consecutive session. The index touched new high of 59,264.25, finishing with 0.54% gains at 59,216.05.</p>"
53,"<p>After taking a breather in the previous session, the frontline Nifty 50 and Sensex indices have resumed their uptrend on November 19.</p>"
54,"<p>Stock market today: Sensex, Nifty rebounded from previous day’s losses, supported by strong gains in IT stocks. Investor sentiment was further boosted by optimism surrounding India–US trade deal annoucement.</p>"
55,"<p>Indian markets eased for the second day on weak global cues, with broader indices slipping and profit-booking visible across sectors, even as IT and FMCG stocks lent some support.</p>"
56,"<p>Nifty 50 and Sensex are likely to see a flat open on November 19, as global markets stage a sell-off on valuation concerns.</p>"
57,"<p>Biggets Nifty gainers were HCL Technologies, Max Healthcare, Infosys, Wipro, TCS, while losers were TMPV, Coal India, Maruti Suzuki, Adani Ports, Bajaj Finance. On the sectoral front, IT index rose 3%, PSU Bank index added 1.2%, Nifty Bank index up 0.5%, while media index down 0.3% and realty index down 0.4%. BSE Midcap index rose 0.3%, while Smallcap index shed 0.4%.</p>"
58,"<p>DIIs continued their buying in this month as they bought equities of Rs 6156 crore on November 18, while the FIIs sold equities of Rs 728 crore.</p>"
59,"<p>For corporates, the steady wage and employment trends directly support top-line growth and improve visibility in sectors such as FMCG, autos, real estate and discretionary spending, Anirudh Garg said.</p>"
60,"<p>If the Nifty 50 manages to defend its previous day’s low (25,876), a rebound toward 26,000 is possible in the upcoming sessions, and only sustaining above this level can give strength to the index for a move toward the 26,100 hurdle, while the immediate support is placed at 25,800.</p>"
61,"<p>Until the Nifty 50 decisively crosses its 26,100 hurdle, consolidation is likely to continue, with immediate support at the 25,800–25,700 zone, followed by 25,500 as a crucial support. Conversely, sustaining above the hurdle can open the door for 26,300–26,500 levels, according to experts.</p>"
62,"<p>The monthly options data indicated that the 26,000 level is expected to be a crucial zone for further directional movement in the Nifty 50. Until then, the index may remain range-bound with key support at the 25,500 level.</p>"
63,"<p>More than 120 stocks touched their 52-week high on the BSE, including GMR Airports, Can Fin Homes, Federal Bank, Bharti Airtel, Chennai Petro, AU Small Finance Bank, Hero MotoCorp, IIFL Finance, Nykaa, Asahi India, SBI, Canara Bank, Marico, Indian Bank, Laurus Labs, TVS Holdings, UPL, among others.</p>"
64,"<p>Stock market today: Sensex, Nifty see recovery on strong September quarter earnings and FII buying in previous session.</p>"
65,"<p>Stock market today: Sensex, Nifty declined amid subdued trends in global markets, broad-based profit-booking and pressure in metal and IT stocks.</p>"
66,"<p>Indian markets pulled back slightly on November 18 after six consecutive sessions of gains, but analysts say resilient Q2 earnings, improving fundamentals and progress in India–US trade discussions are likely to keep sentiment supported in the near term.</p>"
67,"<p>Nifty 50 and Sensex may see a muted start to trade on November 18,  as the risk-off mood in global equities could pressure sentiment.</p>"
68,"<p>Bharti Airtel, Axis Bank, Power Grid Corporation, Bajaj Auto, Asian Paints were among major gainers on the Nifty, while losers were Tech Mahindra, Tata Consumer, Jio Financial, Interglobe Aviation, Bajaj Finserv. BSE midcap index shed 0.7 percent and smallcap index shed 0.8%. All the sectoral indices ended in the red with IT, metal and realty down 1 percent each.</p>"
69,"<p>After remaining net sellers for the last five sessions, the Foreign Institutional Investors (FIIs) turned net buyers on November 17 as they bought equities of Rs 442 crore, while  Domestic Institutional Investors (DIIs) bought equities of Rs 1465 crore on the same day.</p>"
70,"<p>A formal announcement of India-US trade deal is expected before the holiday season, said Rohit Gulati.</p>"
71,"<p>Sustaining above the 26,000 zone can take the Nifty 50 index toward the October high (26,100), and above it, 26,277 (record high) is the level to watch. However, support is placed at the 25,900–25,800 zone, experts said.</p>"
72,"<p>According to experts, if the Nifty 50 sustains this zone, 26,100 (the October high) will be the immediate level to watch, followed by 26,300 (near the record high) in the upcoming sessions. The immediate support has also shifted higher to the 25,900–25,800 zone.</p>"
73,"<p>The Nifty 50 formed a bullish candle with a minor lower shadow on the daily timeframe—indicating a healthy trend with buying interest at lower levels, as well as signalling continuation of the uptrend.</p>"
74,"<p>Broader indices have outperformed the main indices with Nifty Midcap hitting fresh record high of 61,211.05, while Nifty smallcap index rose 0.52 percent.</p>"
75,"<p>Benchmark indices rose for the sixth straight session on November 17, driven by strong gains in banking and financial stocks and broad-based sectoral support.</p>"
76,"<p>Stock market today: Sensex, Nifty rose amid strong buying in financials on the back of healthy September earnings performance by corporates.</p>"
77,<p>Broader markets outperformed benchmarks even as investors shifted focus from earnings to upcoming India–US trade discussions.</p>
78,"<p>Indian markets are poised for a positive start on November 17, with Nifty and Sensex expected to extend their winning streak despite cautious global cues.</p>"
79,<p>Wall Street ended mixed on Friday as investors awaited Nvidia’s results next week and fretted that the Federal Reserve may delay a December rate cut.</p>
80,"<p>Venkatesh Balasubramaniam expects GDP growth to be around 7% in FY26, on the back of revival in consumption and a pickup in capex intensity. Adequate monsoons and comfortable reservoir levels would support sowing activity, aiding overall economic growth.</p>"
81,"<p>Bajaj Auto, Tata Consumer, Eicher Motors, Max Healthcare, Maruti Suzuki were among major gainers on the Nifty, while losers were TMPV, Adani Enterprises, Jio Financial, Interglobe Aviation, UltraTech Cement. All the other sectoral indices ended in the green with auto, bank, realty, capital goods, consumer durables, PSU Bank up 0.5-1%. BSE Midcap and smallcap indices rose 0.6% each.</p>"
82,"<p>This week, the market is expected to remain in positive terrain with focus on the progress in India-US trade talks, FOMC minutes, FIIs mood, PMI numbers and US jobs data.</p>"
83,"<p>If the Nifty 50 reclaims and sustains above Friday’s high (26,000), 26,100 is the immediate resistance to watch, followed by 26,300 as the crucial hurdle. However, the immediate support zone is 25,800–25,700, followed by 25,450 as the crucial support, experts said.</p>"
84,"<p>As long as the Nifty 50 sustains above 25,700, the upward journey toward the 26,000–26,100 hurdle is possible in the upcoming sessions; however, falling below this can bring the index toward the crucial support of the 25,500–25,450 zone, according to experts.</p>"
85,"<p>Overall, technical patterns suggest Bank Nifty is potentially entering the 3rd wave higher, said Ashish Kyal.</p>"
86,<p>Infra is another sector that Kush Gupta follows very closely. H thinks the sector has given good returns and will continue to shine.</p>
87,"<p>Going forward, if valuations turn attractive or earnings upgrades gain meaningful momentum, the market could initiate its next bull phase, Shailendra Kumar believes.</p>"
88,"<p>The weekly options data indicated 26,000 as the immediate hurdle for the Nifty 50, with the 25,800-25,700 range as support.</p>"
89,"<p>Benchmarks staged a late rebound on November 14, extending their five-session winning streak despite weak global cues and initially muted reaction to the Bihar election results.</p>"
90,"<p>Foreign investors sharply reduced their holdings in Indian equities to the lowest level in over 15 years, even as domestic mutual funds and DIIs continued to strengthen their ownership across the market.</p>"
91,"<p>Stock market today: Sensex, Nifty saw recovery from day's low after initial volatility, with participants responding to indications that the ruling NDA was headed for a comfortable victory in Bihar.</p>"
92,"<p>Stock market today: Sensex, Nifty declined on the day of the Bihar election results, as analysts said markets had already priced in an NDA victory and were now shifting focus to other cues.</p>"
93,<p>Indian equities opened lower on Friday as weak global cues and election-related caution weighed on investor sentiment.</p>
94,"<p>Dalal Street's key indices Nifty 50 and Sensex may be poised for a start in the red on November 14, weighed down by poor global cues.</p>"
95,"<p>Wall Street ended sharply lower on Thursday, with steep losses in Nvidia and other AI heavyweights, as investors scaled back expectations of interest rate cuts due to inflation worries and divisions among central bankers about the U.S. economy's health.</p>"
96,"<p>The Sensex recovered nearly 400 points from the day’s lows, while the Nifty reclaimed the 25,900 mark. Market breadth, however, stayed negative with 2,115 stocks declining against 1,879 advancing.</p>"
97,"<p>If the Nifty 50 manages to hold above 25,800 (Thursday’s low) in the upcoming sessions, the 26,000–26,100 levels are the ones to watch. However, below this level, 25,700–25,500 remains the immediate key support zone, experts said.</p>"
98,"<p>Going forward, Raghvendra Nath said it would be important for inflation to remain moderate for interest rates to be cut further. If this play out, the overall demand scenario is likely to improve more, which could bring fresh momentum into the market.</p>"
99,"<p>For a further uptrend toward the 26,100–26,200 zone, the Nifty 50 needs to climb and sustain above 26,000. Until then, consolidation and range-bound trading may be seen, with support at 25,800–25,700, according to experts.</p>"
100,"<p>The weekly options data indicated that the Nifty 50 is likely to face resistance at 26,000–26,200, with support at 25,800 in the short term.</p>"
101,"<p>More than 120 smallcap stocks hit 52-week low, including Cohance Life, DCX Systems, Kopran, Go Fashion, Kabra Extrusion, Lincoln Pharma, Dhunseri Investments, KNR Construction, Sundaram-Clayton, Saregama India,HG Infra Engineering, Wonderla, Quess Corp, Ceinsys Tech, among others.</p>"
102,"<p>After seeing a sharp upmove in the afternoon half of the session, the benchmark indices failed to maintain the momentum and settled flat.</p>"
103,<p>Stock market today: Traders took some profits off the tables ahead of the results of the all-important Bihar Assembly polls</p>
104,"<p>Analysts attributed the market upmove to expectations of a rate cut by RBI after decline in October retail inflation,</p>"
105,"<p>Domestic indices opened flat on November 13, with investors turning cautious after a three-day rally despite supportive cues from easing inflation and global optimism.</p>"
106,"<p>Domestic indices are expected to open flat on November 13, with investors turning cautious after a three-day rally despite supportive cues from easing inflation and global optimism.</p>"
107,"<p>Gold was steady after rising almost 2% in the previous session, as traders weighed an uncertain US
economic outlook that’s been compounded by an absence of reliable data.</p>"
108,"<p>For long-term investors, Ambit's Sushant Bhansali believes IT sector offers value compared to many other areas of the market.</p>"
109,"<p>BSE Midcap and smallcap indices were down 0.3 percent each. Asian Paints, ICICI Bank, L&amp;T, Interglobe Aviation, Hindalco were among major gainers on the Nifty, while losers were Eternal, Shriram Finance, Adani Ports, Bharat Electronics and M&amp;M. Among sectors, IT, media, PSU bank shed 0.5% each, while metal, pharma, realty rose 0.5% each.</p>"
110,"<p>If the Nifty 50 defends the 25,800–25,700 zone, the uptrend toward 26,000 and 26,100 (October high) can continue in the upcoming sessions; however, falling below it can open the door for 25,500, experts said.</p>"
111,"<p>Now, the Nifty 50 needs to reclaim and sustain above 25,900 for a further upward move toward the 26,000–26,100 hurdle. However, 25,700 is expected to act as a support level, according to experts.</p>"
112,"<p>The weekly options data suggested that the Nifty 50 is likely to trade within the 25,500–26,000 range in the short term.</p>"
113,"<p>Biggest Nifty gainers were Asian Paints, Adani Enterprises, Tech Mahindra, TCS, HDFC Life, while losers were Tata Steel, TMPV, Bharat Electronics, Shriram Finance, Grasim Industries.</p>"
114,"<p>Indian markets extended their winning run for the third straight session on Wednesday, with Nifty and Sensex rallying over 0.7 percent amid optimism</p>"
115,<p>Optimism over a possible India-US trade deal and easing concerns about the US government shutdown also supported market momentum.</p>
116,"<p>Nifty 50 opened with a gap-up and Sensex extended gains for the third straight session on Wednesday, November 12, as upbeat global cues, hopes of an India-U.S. trade deal, and favorable Bihar exit polls lifted market sentiment.</p>"
117,"<p>Dalal Street is set for a strong open on Wednesday, November 12, as positive global cues and easing U.S. shutdown concerns lift investor sentiment.</p>"
118,"<p>The Dow Jones Industrial Average surged to a record high close on Tuesday, lifted by progress toward ending the longest U.S. government shutdown, while Nvidia and other artificial intelligence-related companies fell on renewed concerns about elevated valuations.</p>"
119,"<p>The biggest takeaway from the September-quarter earnings season is that the downgrade cycle is finally nearing an end, said Vinit Sambre of DSP MF.</p>"
120,"<p>Biggest Nifty gainers were Asian Paints, Adani Enterprises, Tech Mahindra, TCS, HDFC Life, while losers were Tata Steel, TMPV, Bharat Electronics, Shriram Finance, Grasim Industries. BSE Midcap index rose 0.4 percent and smallcap index added 0.7 percent. Except, realty, all other sectoral indices ended in the green with media, auto, telecom, IT, consumer durables up 1-2 percent.</p>"
121,"<p>Sustaining above 25,670 zone can drive the Nifty 50 toward 25,800 (the previous week’s high), as above it, 26,000 is the level to watch, while support is placed at 25,500–25,450 in the short term, experts said.</p>"
