,0
122,"<p>If the Nifty 50 sustains above 25,670 level and decisively clears the 25,800 hurdle, 26,000 is the level to watch in the upcoming sessions. However, on the lower side, 25,500–25,450 is expected to act as immediate support, according to experts.</p>"
123,<p>Today's market action indicated strong buying interest at lower levels and a continuation of upside momentum amidst high volatility.</p>
124,"<p>More than 100 stocks touched their 52-week high on the BSE, including Craftsman, Bharat Forge, BHEL, NALCO, Ashok Leyland, Hitachi Energy, M&amp;M, Asahi India, Muthoot Finance, Can Fin Homes, IOC, Shriram Finance, Torrent Pharma, MCX India, Laurus Labs, among others.</p>"
125,"<p>Indian markets recovered from early losses on November 11, with Nifty 50 and Sensex stabilising near the flatline.</p>"
126,"<p>Stock market today: Sensex, Nifty recovery was driven by hopes of progress in India-US trade discussions and expectations of an end to the US government shutdown.</p>"
127,"<p>Stock market today: Sensex, Nifty see profit booking on liquidity concerns amid a busy primary market and FII selling.</p>"
128,<p>Dalal Street opened flat on November 11 as global optimism around the U.S. shutdown bill and progress on a potential trade deal lifted sentiment.</p>
129,<p>Indian equity indices Nifty 50 and Sensex likely to open higher on November 11 as global cues turn positive after U.S. shutdown bill progresses.</p>
130,"<p>Gold held gains after recording its biggest daily jump since May, with an imminent end to the longest government shutdown in US history raising the prospect of further interest-rate cuts.</p>"
131,"<p>BSE Midcap and Smallcap indices ended flat. Interglobe Aviation, Bharat Electronics, Bajaj Auto, M&amp;M and HCL Technologies were among top gainers on the Nifty, while losers were Bajaj Finance, Bajaj Finserv, ONGC, TMPV, Power Grid. Among sectors, PSU Bank, healthcare down 0.3 each, while telecom index up 1.5%, IT index up 1%, oil &amp; gas index up 0.7%, auto index up 1% and metal index up 0.6%.</p>"
132,<p>Manish Jain of Centrum would prefer large private sector banks which offer valuation comfort with relatively more secure loan book.</p>
133,"<p>If the Nifty 50 manages to defend the immediate support of 25,500 in the upcoming sessions, a gradual rally toward 25,700–25,800 can’t be ruled out, followed by 26,000 being a key resistance area. However, crucial support is placed at 25,300.</p>"
134,"<p>If the Nifty 50 manages to hold 25,500, which acts as immediate support, an upward move toward 25,700–25,800 in the upcoming sessions is possible. However, 25,300 is expected to remain a crucial support level, as a decisive break below it could bring bears back into action, experts said.</p>"
135,"<p>The weekly options data indicated that the Nifty 50 is expected to trade in the 25,400–26,000 range in the short term.</p>"
136,"<p>Infosys, HCL Technologies, Grasim Industries, Bajaj Finance, Wipro were among major gainers on the Nifty, while losers were Trent, Apollo Hospitals, Max Healthcare, Power Grid and Tata Consumer.</p>"
137,<p>Indian markets ended a three-day losing streak as optimism from the U.S. resolving its government shutdown boosted global sentiment.</p>
138,"<p>Catch Lovisha Darad in conversation with Milan Vaishnav, ChartWizard FZE and Gemstone Equity Research and Gaurang H Shah, Sr. Vice President, Geojit Financial service Ltd</p>"
139,"<p>Stock market today: Sensex, Nifty rebounded after a 3-day decline, supported by positive global cues and renewed buying by FIIs following six consecutive sessions of selling.</p>"
140,"<p>Nifty 50 and Sensex opened higher on November 10, supported by positive global cues and broad sectoral gains, with metals, PSU banks and oil and gas leading the early upside.</p>"
141,"<p>After a volatile week, the Nifty wrapped up Friday’s session with a sharp intraday recovery, managing to defend the crucial 25,300 support zone. But can this bounce turn into sustained momentum, or was it just a flash in the pan? In today’s episode, Nandita Khemka breaks down the key cues that could shape the trading day — from global cues, market breadth and fund flows to stock-specific action. Plus, all eyes are on eyewear giant Lenskart, which makes its much-anticipated Dalal Street debut today after one of the year’s most talked-about IPOs. In our Voice of the Day segment, catch Nirav Karkera of Fisdom Research who shares his perspective on capital market stocks after the stellar rally on Friday. 
Tune in for all this and more in today’s Market Minutes — your morning podcast bringing you the top stories to kickstart your trading day, from stocks in the news to macro trends and global market cues.</p>"
142,"<p>Despite the rally in Asian markets, Indian equity benchmarks Nifty 50 and Sensex may see a flat open in trade on November 10.</p>"
143,"<p>Indian markets may follow global trends, particularly US market movements, with increased volatility due to the US government shutdown and lack of domestic drivers</p>"
144,"<p>After remaining net sellers for the last six session, Foreign Institutional Investors (FIIs) bought equities of Rs 4581 crore on November 6. However, the Domestic Institutional Investors (DIIs) extended their buying on the 11th consecutive session as they bought equities of over Rs 6674 crore on the same day.</p>"
145,"<p>In the week starting November 10, the market is expected to be range-bound with focus on the final lot of corporate earnings season, and further progress with respect to India-US trade deal.</p>"
146,"<p>Except media (down 1%), all other sectoral indices ended in the green with IT index up 1.6 percent, pharma index up nearly 1 percent, metal index up 0.6 percent. Infosys, HCL Technologies, Grasim Industries, Bajaj Finance, Wipro were among major gainers on the Nifty, while losers were Trent, Apollo Hospitals, Max Healthcare, Power Grid and Tata Consumer. BSE Midcap index up 0.6 percent, while smallcap index fell 0.4 percent.</p>"
147,"<p>On the global front, any delay in India’s potential trade deal with the US or a stronger US dollar could weigh on global risk appetite, impacting flows into emerging markets, including India, said Mahesh Patil.</p>"
148,"<p>A close above 25,800 could trigger the next leg of the upward move in Nifty 50, said Rahul Ghose.</p>"
149,"<p>Experts suggest that if the Nifty 50 manages to hold 25,300 in the upcoming sessions, a gradual upmove toward 25,650–25,800 and then 26,000 could be possible amid consolidation. On the other hand, a decisive break below this level could drive the index toward 25,000.</p>"
150,"<p>According to experts, if the Nifty 50 decisively breaks the strong 25,300 support (50 DEMA), the 25,000 level can’t be ruled out, but holding above it can raise the possibility of the index moving toward 25,650, followed by 25,800, being key resistance.</p>"
151,"<p>While a persistent global growth slowdown could weigh in on Indian economy, a flurry of fiscal and policy measures announced during the year likely limit the extent of further downside, said Himanshu Kohli.</p>"
152,"<p>On the higher side, the 25,650–25,700 band will act as an immediate resistance zone for the Nifty 50. A decisive close above 25,700 could reignite bullish momentum, paving the way for an advance towards 26,000 and subsequently 26,300 in the short term, said Sudeep Shah.</p>"
153,"<p>Most sectoral indices ended in the red, with the Nifty Media index shedding 3.2%, Nifty Defence falling 2%, Nifty Metal declining 1.7%, and Nifty IT slipping 1.6%. However, the Nifty PSU Bank index gained 2%.</p>"
154,<p>The advance-decline numbers are often used to see the inclusive quotient of the market move.</p>
155,"<p>If either of these two drivers of the current bull market falters, the outcome will be a negative surprise, said Umeshkumar Mehta.</p>"
156,<p>Analysts said the current phase reflects cautious sentiment among market participants amid persistent global uncertainties and the absence of major domestic triggers.</p>
157,<p>Broader indices recovered nearly 1.5 percent from day's low with BSE midcap index rising 0.2 percent and smallcap index ending on a flat note.</p>
158,"<p>Benchmark indices ended flat on November 7 as volatility and mixed sectoral trends kept gains in check, with the Nifty closing under 25,500.</p>"
159,"<p>Stock market today: Sensex, Nifty pared early losses amid value buying, supported by positive cues from Wall Street futures.</p>"
160,"<p>Stock market today: Sensex, Nifty extended decline to third straight session as persistent FII selling and weak global cues weighed on domestic equities.</p>"
161,"<p>Broad-based selling gripped the markets, with IT and midcap stocks leading declines</p>"
162,<p>Tech-led sell-off on Wall Street spills into Asia; Indian indices eye third straight day of declines.</p>
163,"<p>US stocks closed in negative territory on Thursday, with a resumption of Tuesday's tech selloff as investors contended with mounting economic uncertainty and stretched valuations.</p>"
164,"<p>The bigger risk for the Indian economy is lack of job creation as a result of employers using AI more, Pramod Gubbi said.</p>"
165,"<p>Among sectors, metal index added 1.4%, while Consumer Durables, FMCG, telecom shed 0.5% each. BSE midcap and smallcap indices ended with marginal gains. Shriram Finance, Adani Enterprises, Tata Steel, Bajaj Finance, HDFC Life were among major gainers on the Nifty, while losers were Bharti Airtel, Tata Consumer, Apollo Hospitals, Tech Mahindra and Interglobe Aviation.</p>"
166,"<p>If the benchmark Nifty 50 breaks its 25,450 support, a fall toward 25,350–25,300 is possible. However, in case of a rebound, 25,700–25,800 are the levels to watch.</p>"
167,"<p>Experts expect the Nifty 50 to decline further towards 25,450. A decisive break below this level could open the door for a fall to 25,350–25,300. However, on the higher side, resistance is placed in the 25,700–25,800 zone.</p>"
168,"<p>Weekly options data indicated that the Nifty may trade in the 25,000–26,000 range in the short term.</p>"
169,"<p>Fourteen of the 16 major sectors fell, while small-cap and mid-cap indexes slipped 1.4% and 1%, respectively</p>"
170,"<p>Stock market today: Sensex, Nifty declined amid profit booking in key sectors, while the persistent FII selling also dented the sentiment.</p>"
171,"<p>Sensex and Nifty started firm, boosted by M&amp;M and Britannia earnings, even as FII selling and weak metal stocks kept gains in check.</p>"
172,"<p>Indian benchmark indices are expected to open higher on Thursday, tracking gains across global markets, with traders watching key earnings and the first weekly expiry of Sensex contracts for the November series.</p>"
173,"<p>On the sectoral front, metal, power, realty, media down 1.5-2.5%. However, FMCG, auto and IT ended with marginal gains. BSE Midcap index fell 1.2%, and smallcap index shed 1.5%. Asian Paints, Interglobe Aviation, M&amp;M, Reliance Industries, UltraTech Cement were among major gainers on the Nifty, while losers were Hindalco, Grasim Industries, Adani Enterprises, Power Grid Corp and Eternal.</p>"
174,"<p>Indian company earnings so far for the September 2025 quarter show a mixed performance. Key sectors like financials and automotive showed robust domestic-driven performance, while export-oriented sectors like IT faced headwinds, said Devang Mehta.</p>"
175,"<p>If the Nifty 50 manages to defend the 25,590 level, the 25,700–25,800 levels are to be watched; however, falling below it can open the door for 25,450 support (the September high, which can now act as a support).</p>"
176,"<p>According to experts, if the Nifty 50 sustains below 25,600, the 25,500–25,400 levels will be key support zones to watch. On the upside, resistance may be faced at the 25,750–25,800 levels, above which 25,600 could be possible.</p>"
177,"<p>On November 4, Indian equity indices ended lower with Nifty finishing below 25,600. Trading on the NSE and the BSE will resume on November 6 (Thursday).</p>"
178,"<p>Sectors that were laggards in the last quarter such as Banking and Consumption have likely found their base and are expected to show better results in the coming year, aided by macro stimulus from the Government and RBI, said Sonal Minhas.</p>"
179,"<p>The Nifty Realty Index has formed a strong base and recently broke out from a rectangle pattern on the daily chart, indicating the potential for a follow-up move on the upside towards Rs 1,050 in the near term, says Jain</p>"
180,"<p>Weekly options data indicated that the Nifty 50 is expected to trade in the 25,200–25,800 range in the short term, with 25,000–26,000 being the broader range.</p>"
181,"<p>140 stocks touched their 52-week high on the BSE, including City Union Bank, MRPL, Asahi India, Delhivery, Titan Company, Bharti Airtel, BPCL, IOC, Laurus Labs, SBI. HPCL, eClerx Services, L&amp;T Finance, Shriram Finance, SBI Life Insurance, Bank of India, MCX India, among others.</p>"
182,"<p>While consumer durables held steady, most sectors dragged, even as analysts see room for incremental buying in the ongoing consolidation phase</p>"
183,"<p>Stock market today: Sensex, Nifty saw profit booking amid weak global cues, while the persistent FII selling also weighed on the sentiment. </p>"
184,"<p>Indian markets opened flat on November 4, with Nifty and Sensex trading flat amid cautious global sentiment and muted Q2 earnings.</p>"
185,"<p>The Nifty 50 failed to see follow-through selling on November 3, ending the session with moderate gains. The index held above the 20-day and 50-day EMAs as well as the midline of the Bollinger Bands, but continued to form a lower high–lower low pattern on the daily chart. Experts say that until these technical indicators turn favourable, the consolidation phase is likely to persist, with the 25,700–25,600 zone acting as key support and 25,500 remaining a crucial downside level. On the upside, the 25,900–26,000 range is expected to pose resistance. Meanwhile, as many as five Nifty companies — including SBI and M&amp;M - are set to announce their quarterly earnings today. On the primary market front, the Groww IPO opens for subscription while the Lenskart IPO closes. Catch Nandita Khemka in conversation with Hemen Kapadia, Technical Associate, DRChoksey Finserv, and Vinit Sambre, Head – Equities, DSP Mutual Fund.</p>"
186,<p>The selling from FIIs continued on fourth consecutive day as they sold equities of Rs 1883 crore on November 1</p>
187,"<p>While the India–US trade deal will certainly add another layer of confidence, the near-term market focus remains on sustained earnings delivery and macro stability, said Nikunj Doshi.</p>"
188,"<p>Biggest Nifty losers were Power Grid Corp, Coal India, Tata Motors Passenger Vehicles, Bajaj Auto, Eternal, while gainers included Titan Company, Bharti Airtel, Bajaj Finance, HDFC Life, M&amp;M. Except consumer durable and telecom, all other sectoral indices ended in the red with IT, auto, FMCG, metal, power, realty, PSU indices down 0.5-1%. BSE midcap index fell 0.2% and smallcap index shed 0.7%.</p>"
189,"<p>Until all indicators align positively, the consolidation phase may continue, with the 25,700–25,600 zone acting as key support. Below this, 25,500 remains a crucial support level. On the higher side, the 25,900–26,000 zone is expected to act as a hurdle, according to experts.</p>"
190,"<p>The Nifty 50 index is expected to consolidate further with support in the 25,700–25,600 zone, while on the higher side, the 25,900–26,000 levels are to be watched, as sustaining above them can drive the index toward a record high, experts said.</p>"
191,"<p>The weekly options data continues to show 26,000 as a resistance for the Nifty 50, while support is placed in the 25,700–25,500 range.</p>"
192,"<p>Shriram Finance, M&amp;M, Apollo Hospitals, SBI, Tata Consumer were among major gainers on the Nifty, while losers included Maruti Suzuki, ITC, TCS, Bharat Electronics, L&amp;T.</p>"
193,"<p>Broader markets outperformed, while the debut of Lenskart’s IPO added to the market buzz.</p>"
194,"<p>Stock market today: Sensex, Nifty recovered early losses amid value buying. Positive global cues also added to the sentiment.</p>"
195,"<p>While PSU Bank and Metal stocks lent support, FMCG and IT shares weighed on sentiment as investors tracked Q2 results and India–US trade cues.</p>"
196,"<p>Analysts see Nifty trading in a narrow band this week as investors focus on auto sales data and key earnings from SBI, Bharti Airtel, Titan, and Tata Chemicals.</p>"
197,<p>Foram Chheda has a neutral to mildly bullish view for the equities ahead in November.</p>
198,"<p>The FIIs continued their selling on third straight session as they sold equities of Rs 6769 crore on October 31. However, the DIIs continued their buying on 7th consecutive session as they bought equities of over Rs 7000 crore on the same day.</p>"
199,"<p>Investor sentiment is increasingly optimistic, with the market recognizing that the earnings cycle is nearing its trough. Expectations of a rebound into double-digit growth suggest a favourable setup for sustained momentum and further upside, said Niraj Kumar of Generali Central Life Insurance.</p>"
200,"<p>BSE Midcap index rose 0.6 percent and smallcap index added 0.7 percent. On the sectoral front, pharma, telecom, realty, PSU Bank indices added 1-2 percent. Shriram Finance, M&amp;M, Apollo Hospitals, SBI, Tata Consumer were among major gainers on the Nifty, while losers included Maruti Suzuki, ITC, TCS, Bharat Electronics, L&amp;T.</p>"
201,"<p>The benchmark indices will likely remain range-bound and consolidative, with a focus on quarterly earnings, management commentaries for the second half of FY26, further developments related to India–US trade talks as well as US–China trade, the mood of FIIs, and global cues, experts said.</p>"
202,"<p>If the Nifty decisively breaks 25,700–25,670, the 25,500–25,400 levels are the next to watch, as selling pressure may widen below this zone. However, on the higher side, 25,900–26,000 is the immediate hurdle, followed by 26,100, experts said.</p>"
203,"<p>Momentum indicators signaled some caution in the short term, especially after a sharp rally in October. A breakdown below 25,500-25,400 area could strengthen the bears, whereas holding above it amid the current nervousness and consolidation could push the Nifty 50 back toward 25,900–26,000, according to experts.</p>"
204,"<p>The risks to the market are more likely to emanate from financial stress in major developed economies and global geopolitical tensions, Shahzad Madon of TCG Asset Management Company said.</p>"
205,"<p>The Domestic Institutional Investors (DII) continued their buying on 28th week, as they bought equities worth Rs 18,804.26 crore, while the Foreign Institutional Investors' (FIIs) sold equities worth Rs 2102 crore.</p>"
206,"<p>Sagility breached its previous high of Rs 56.40 but failed to sustain, forming a bearish engulfing candle on the daily chart — a potential reversal signal, Sudeep Shah said.</p>"
207,"<p>The ongoing result season is on expected lines, which is pivoted on weak demand scenario, margin pressure and companies working towards cost optimisation to keep profitability afloat, said Dhananjay Sinha.</p>"
208,"<p>Weekly options data also indicates that the Nifty is expected to remain in the 25,500–26,100 range in the short term.</p>"
209,"<p>Banks in several cities will also remain closed on November 5 for Guru Nanak Dev Ji Jayanti, as per the Reserve Bank of India’s holiday schedule.</p>"
210,"<p>Among sectors, PSU Bank index rose 1.5%, while power, metal, media shed 1% each and IT, private bank, healthcare index down 0.5% each.</p>"
211,"<p>On October 31, benchmark indices Nifty 50 and Sensex ettled on a muted noted as investors took some profits off the table.</p>"
212,"<p>Stock market today: Sensex, Nifty declined as sustained FII outflows and cautious global trends kept traders on the sidelines.</p>"
213,"<p>Asian markets traded higher, with South Korea’s Kospi and Japan’s Nikkei 225 posting gains.</p>"
214,"<p>Indian markets opened lower on October 31 amid weak global cues, FII selling. The Nifty 50 opened under 25,900, while the Sensex flat in the red.</p>"
215,"<p>GIFT Nifty hinted at a flat-to-positive start for Indian markets on Friday, with investors eyeing global cues, rupee movement, and key Q2 earnings.</p>"
216,"<p>The Foreign Institutional Investors (FIIs) extended their selling on second day as they sold of Rs 3150 crore on October 30. However, the Domestic Institutional Investors (DIIs) continued their buying on sixth consecutive session as they bought equities of Rs 2577 crore on the same day.</p>"
217,"<p>Following another cut in the federal funds rate, Stefan Hofer believes the Federal Reserve could move again in December with an additional rate cut—especially if lower tariffs help ease inflationary pressures.</p>"
218,"<p>Bharat Electonics, Eicher Motors, Shriram Finance, L&amp;T, TCS were among major gainers on the Nifty, while losers were Cipla, Eternal, Max Healthcare, NTPC, Interglobe Aviation. Among sectors, PSU Bank index rose 1.5%, while power, metal, media shed 1% each and IT, private bank, healthcare index down 0.5% each. BSE Midcap index slipped 0.5% and Smallcap indices down 0.4%.</p>"
219,"<p>Until the Nifty 50 achieves a decisive breakout and sustains above 26,100 — the key hurdle — consolidation amid rangebound trading may continue, with immediate support in the 25,800–25,700 zone.</p>"
220,"<p>If the Nifty 50 stays below 26,000, the consolidation may continue with support at 25,800–25,700, followed by 25,500 as a crucial support level. However, climbing decisively above 26,000 can open the door for the 26,100–26,300 zone, according to experts.</p>"
221,"<p>The weekly options data suggested that 26,000 is expected to act as a strong resistance for the Nifty 50, with key support at 25,500.</p>"
222,"<p>Indian equities closed lower on October 30, with Nifty slipping below 26,000 and Sensex falling nearly 600 points as cautious global cues.</p>"
223,"<p>Shares of PB Fintech, the parent company of Policybazaar, rose 5.26 per cent to Rs 1,814 on the NSE.</p>"
224,"<p>Stock market today: Sensex, Nifty declined as fresh foreign fund outflows and lack of clarity on December rate cut by US Fed dampened investors' sentiment.</p>"
225,"<p>Stock Market LIVE Updates: Among sectoral indices, Nifty Private Bank was the biggest loser, down 0.7 percent, followed by Nifty Pharma, Nifty IT, and Nifty Bank, which fell 0.6 percent each. Nifty Metal, PSU Bank, Auto, and FMCG indices were also down 0.5 percent each.</p>"
226,"<p>On a PE basis, Lenskart does look expensive but one should look at what the normalized margins would be in future when growth has stabilized or as compared to some global or domestic peers and then see if on that basis what would be the normalized PE ratio.</p>"
227,"<p>The Nifty 50 needs to defend 26,000 level consistently for an upmove toward 26,300, followed by 26,500. Until then, consolidation and range-bound trading may continue, with support at the 25,900–25,800 levels, experts said.</p>"
228,"<p>Experts noted that holding above 26,000 can open the door for a move toward the immediate target of 26,100, followed by 26,300 (near the record high), while the 25,900–25,800 zone can act as a key support area for the Nifty 50.</p>"
229,"<p>The weekly options data suggested a medium-term target for the Nifty 50 at 27,000, with 26,200 and 26,500 serving as immediate targets—provided 26,000 continues to hold as a crucial support level.</p>"
230,"<p>More than 170 stocks touched their 52-week high on the BSE, including SAIL, Graphite India, IOC, M&amp;M Financial, HPCL, JSW Steel, Tata Steel, SBI Life Insurance, Jindal Stainless, Grasim Industries, among others.</p>"
231,"<p>Sectoral indices saw buying led by Oil &amp; Gas, Metal, IT and FMCG, rising up to 2 percent.</p>"
232,"<p>Foreign institutional investors bought shares worth Rs 10,339.80 crore on Tuesday, the highest single-day purchase since June 26, 2025.</p>"
233,"<p>Stock market today: Sensex, Nifty rose on hopes of early India-US trade deal after Trump's recent comment.</p>"
234,"<p>The Foreign Institutional Investors (FIIs) bought equities of Rs 10,000 crore on October 28 and turned net buyers for the month. On the other hand, while the Domestic Institutional Investors (DIIs) bought equities of Rs 636 crore on the same day.</p>"
235,"<p>Divam Sharma remains optimistic about the market’s trajectory in November, expecting a healthy mix of momentum and selective sectoral strength to drive performance.</p>"
236,"<p>As long as the Nifty sustains above the 25,500–25,600 zone, the bias remains constructively bullish. Traders should adopt a buy-on-dips strategy, focusing on accumulation near supports.</p>"
237,"<p>Adani Enterprises, Power Grid Corp, NTPC, Adani Ports, JSW Steel were among biggest gainers on the Nifty, while losers included Dr Reddy's Labs, Maruti Suzuki, Eternal, M&amp;M, Coal India. BSE Midcap index added 0.7 percent and smallcap index rose 0.6%. Among sectors, except auto (down 0.7%), all other indices ended in the green with media, metal, oil &amp; gas up 1-2%.</p>"
238,"<p>According to experts, if the Nifty 50 closes and sustains above the 26,000 level, 26,100 followed by 26,300 can be possible in the upcoming days, with support at 25,800–25,700.</p>"
239,"<p>Experts believe the Nifty 50 is gradually expected to reclaim 26,100, followed by 26,300 (near its previous record high) in the upcoming sessions, once it starts trading above the psychological 26,000 mark. On the downside, support is placed in the 25,850–25,800 zone.</p>"
